{
  "schema_version": "v1",
  "partition": "validation",
  "content_hash": "aaaaaaaaaaaaaaaaaaaaaaaaaaaaaaaaaaaaaaaaaaaaaaaaaaaaaaaaaaaaaaaa",
  "cases": [
    {
      "case_id": "case-1",
      "case_version": "v1",
      "case_hash": "bbbbbbbbbbbbbbbbbbbbbbbbbbbbbbbbbbbbbbbbbbbbbbbbbbbbbbbbbbbbbbbb"
    }
  ]
}
